Rumah Baru Semi Furnished Depan TAMAN dekat Gelael, Tebet Barat, Jakarta Selatan;0,0469;0,1101;0,0379;0,375;0,3333;0
Rumah Tebet Barat Dalam - Jakarta Selatan, Tebet, Jakarta Selatan;0,0344;0,0696;0,0238;0,25;0,1111;0
4 Bedrooms House Tebet, Jakarta Selatan, DKI Jakarta;0,025;0,0913;0,029;0,25;0,3333;0
Di Jual Rumah Cantik di Tebet Jalan 1 Mobil Jakarta Selatan;0,0828;0,1759;0,0936;0,25;0,2222;0
Rumah Brand New Minimalis Modern Bebas Banjir di Tebet;0,0375;0,0913;0,0416;0,125;0,2222;0
4 Bedrooms House Tebet, Jakarta Selatan, DKI Jakarta;0,0352;0,1289;0,0267;0,25;0,2222;0
Dijual Rumah Cantik Minimalis Di Tebet Dekat Taman;0,0313;0,0818;0,0305;0,25;0,3333;0
Rumah Murah Siap Huni Akses 2 Mobil Tebet Timur Jak Sel;0,0484;0,1101;0,075;0,25;0,2222;0
Rumah Strategis Cocok Untuk Usaha Posisi Huk Di Tebet Timur;0,0859;0,063;0,0788;0,25;0;0,1111
Rumah Strategis Siap Huni Akses 1mobil Di Tebet Barat;0,0391;0,0818;0,0602;0,25;0,2222;0
Rumah Siap Huni Hanya 50meter Ke Jalan Asembaris Raya;0,0172;0,0348;0,0535;0;0,1111;0
Rumah 2lantai Strategis Akses 2mobil Lokasi Asembaris Tebet;0,0313;0,1289;0,0527;0;0,1111;0
Rumah Asri Siap Huni Strategis Lokasi Asembaris Bebas Banjir;0,018;0,0611;0,0602;0,125;0,1111;0
Rumah Baru 2,5 Lantai Akses 1mobil Lokasi Tebet Timur;0,0313;0,1289;0,0267;0,125;0,1111;0,1111
Rumah Bagus Siap Huni Tebet Barat Jak Sel;0,0352;0,0536;0,0371;0,25;0,2222;0
Rumah Sederhana Di Tebet Timur Jak Sel;0,0117;0,0207;0,0267;0;0;0
Rumah Siap Huni Ada Kosan 4pintu Lokasi Tebet Barat Jak Sel;0,0438;0,1289;0,0676;0,75;0,7778;0
Rumah Strategis Siap Huni Akses 1mobil Dekat Pasar Tebet Jak Sel;0,0234;0,0536;0,0342;0,125;0,1111;0
Rumah Lama Layak Huni Akses 2 Mbl Bs Utk Kosan Di Menteng Dlm Jak Sel;0,05;0,1759;0,1129;0,375;0,3333;0
Rumah Baru Siap Huni Akses 2mobil Semi Furnised Lokasi Tebet Utara;0,0547;0,0611;0,0267;0,125;0,2222;0
Rumah Siap Huni Posisi Huk Akses 2mobil 200meter Kejalan Supomo;0,0938;0,0818;0,0416;0,25;0,2222;0
Rumah Strategis 100meter Ke Jl Supomo Di Menteng Dalam Tebet Jak Sel;0,025;0,0348;0,0639;0,125;0,1111;0
Rumah Strategis Akses Jalan 2mobil Di Menteng Dalam Tebet Jak Sel;0,125;0,3641;0,3685;1;1;0,2222
Tebet Rumah Siap Huni Jln 2 Mbl Nyaman;0,0469;0,0913;0,0639;0,25;0,2222;0,1111
Di Kebun Baru Rumah Terawat, Area Strategis;0,0469;0,0715;0,1308;0,25;0,3333;0
Dijual Rumah Kokoh Di Gudang Peluru;0,1484;0,3358;0,2793;0,625;0,3333;0,1111
